{
  "schema_version":1,
  "evidence_kind":"GENERIC_ROUTE_DIFFERENTIAL_MEASUREMENT",
  "evidence_state":"NON_PARITY_EVIDENCE_ONLY",
  "parity_claim":"NONE",
  "route_id":"REPLACE_ROUTE_ID",
  "route_kind":"LICENSED_LOCAL_INFERENCE_SDK",
  "runtime_artifact_sha256":"REPLACE_64_HEX",
  "measurement":{"exact_input_bytes":true,"overall_usability_delta_project_minus_reference":null,"material_inferiority_detected":false,"overall_usability_threshold_pass":false,"material_inferiority_vote_pass":false}
}
